{
  "id": "cde53223-81ef-4a2b-bb41-134a46dc03a4",
  "name": "感染症・予防接種審査分科会（令和元年9月27日以前）",
  "parent": "f63e8af6-b433-4db5-86b3-f88c20a399fe",
  "category": "国/審議会(子)",
  "list_url": "https://www.mhlw.go.jp/stf/shingi/shingi-shippei_127696.html",
  "official_url": "https://www.mhlw.go.jp/stf/shingi/shingi-shippei_127696.html"
}