{
  "id": "d6636ea0-c7a4-486d-83cc-0dfdf5969c86",
  "name": "職業能力開発分科会若年労働者部会（旧勤労青少年部会）",
  "parent": "b206a532-05aa-4a99-aa3f-1bfcb32a35f8",
  "category": "審議会(子)",
  "list_url": "https://www.mhlw.go.jp/stf/shingi/shingi-rousei_126987.html",
  "official_url": "https://www.mhlw.go.jp/stf/shingi/shingi-rousei_126987.html"
}