{
  "id": "1c1d7c58-61d9-461c-ab33-1713fdb49671",
  "name": "クロイツフェルト・ヤコブ病等委員会",
  "parent": "adbed643-3bef-4dc1-8c78-82f6d7c37d08",
  "category": "国/審議会(子)",
  "list_url": "https://www.mhlw.go.jp/stf/shingi/shingi-kousei_127749.html",
  "official_url": "https://www.mhlw.go.jp/stf/shingi/shingi-kousei_127749.html"
}