{
  "id": "be5a225e-db15-4e9d-81f0-c9ebcaa41da3",
  "name": "障害者部会精神障害分会",
  "parent": "78d683d4-6555-4961-aebf-39848aff5e09",
  "category": "審議会(子)",
  "list_url": "https://www.mhlw.go.jp/stf/shingi/shingi-hosho_126732.html",
  "official_url": "https://www.mhlw.go.jp/stf/shingi/shingi-hosho_126732.html"
}