{
  "id": "42e6196a-06bc-426c-acea-fe746018524b",
  "name": "医療観察法部会",
  "parent": "78d683d4-6555-4961-aebf-39848aff5e09",
  "category": "国/審議会(子)",
  "list_url": "https://www.mhlw.go.jp/stf/shingi/shingi-hosho_126733.html",
  "official_url": "https://www.mhlw.go.jp/stf/shingi/shingi-hosho_126733.html"
}