{
  "id": "7bb5c751-5db6-48e9-8450-c92064d1b723",
  "name": "保険医療材料等専門組織",
  "parent": "7fed6615-074f-4b86-b78c-5b8eac7cb762",
  "category": "審議会(子)",
  "list_url": "https://www.mhlw.go.jp/stf/shingi/shingi-chuo_128167_00018.html",
  "official_url": "https://www.mhlw.go.jp/stf/shingi/shingi-chuo_128167_00018.html"
}