{
  "id": "7ae80be5-f80e-4eef-b97e-d964983d92d2",
  "name": "歯科医師国家試験出題基準改定部会",
  "parent": "58e94bfa-2a3e-468a-b343-5a3c0bdfc66f",
  "category": "国/審議会(子)",
  "list_url": "https://www.mhlw.go.jp/stf/shingi/shingi-idou_341268.html",
  "official_url": "https://www.mhlw.go.jp/stf/shingi/shingi-idou_341268.html"
}