{
  "id": "a84aa824-ad7c-4210-965d-6cc0ef80094c",
  "name": "児童虐待等要保護事例の検証に関する専門委員会",
  "parent": "1c790c4b-30dc-4cb3-9a1d-1383b8125d19",
  "category": "国/審議会(子)",
  "list_url": "https://www.mhlw.go.jp/stf/shingi/shingi-hosho_126713.html",
  "official_url": "https://www.mhlw.go.jp/stf/shingi/shingi-hosho_126713.html"
}