{
  "id": "a8ddb9d3-cb58-4188-aae2-8cc0ebe64804",
  "name": "診療報酬調査専門組織（医療技術評価分科会）",
  "parent": "7fed6615-074f-4b86-b78c-5b8eac7cb762",
  "category": "審議会(子)",
  "list_url": "https://www.mhlw.go.jp/stf/shingi/shingi-chuo_128167.html",
  "official_url": "https://www.mhlw.go.jp/stf/shingi/shingi-chuo_128167.html"
}