{
  "id": "76a2df81-874c-4a76-94c5-e1012ffeed1a",
  "name": "受動喫煙対策専門委員会",
  "parent": "011ceda6-2a96-4818-b0ba-3d9b2530d20d",
  "category": "国/審議会(子)",
  "list_url": "https://www.mhlw.go.jp/stf/shingi/shingi-kousei_127752_00008.html",
  "official_url": "https://www.mhlw.go.jp/stf/shingi/shingi-kousei_127752_00008.html"
}