{
  "id": "57c4c8a4-5b8b-4612-9354-c87f4077ca30",
  "name": "中央職業能力開発協会の在り方に関する専門委員会",
  "parent": "274c04eb-49b6-4bd4-b7a3-9ae7c67cc75d",
  "category": "審議会(子)",
  "list_url": "https://www.mhlw.go.jp/stf/shingi/shingi-rousei_126988.html",
  "official_url": "https://www.mhlw.go.jp/stf/shingi/shingi-rousei_126988.html"
}