{
  "id": "514c53e8-e028-41b7-a8c6-515c397d961e",
  "name": "児童館のあり方に関する検討ワーキンググループ",
  "parent": "9f96c8c9-bb48-447e-b29b-21fe38710fc8",
  "category": "国/審議会(子)",
  "list_url": "https://www.mhlw.go.jp/stf/shingi/shingi-hosho_491253_1.html",
  "official_url": "https://www.mhlw.go.jp/stf/shingi/shingi-hosho_491253_1.html"
}