{
  "id": "1ef4d890-4ebb-4fdc-8365-aa4954eee04d",
  "name": "人口構造の変化に関する特別部会",
  "parent": "78d683d4-6555-4961-aebf-39848aff5e09",
  "category": "国/審議会(子)",
  "list_url": "https://www.mhlw.go.jp/stf/shingi/shingi-hosho_126705.html",
  "official_url": "https://www.mhlw.go.jp/stf/shingi/shingi-hosho_126705.html"
}