{
  "id": "495d5b79-7455-4079-8b86-9b551abc6dc8",
  "name": "電気事業及び石炭鉱業における争議行為の方法の規制に関する法律の在り方に関する部会",
  "parent": "b206a532-05aa-4a99-aa3f-1bfcb32a35f8",
  "category": "審議会(子)",
  "list_url": "https://www.mhlw.go.jp/stf/shingi/shingi-rousei_214638.html",
  "official_url": "https://www.mhlw.go.jp/stf/shingi/shingi-rousei_214638.html"
}