{
  "id": "34c50248-9d4d-420f-a1c1-3ba1f1b66d44",
  "name": "核酸等の第一種使用等に関する専門委員会",
  "parent": "e6ece248-8a8e-4cdd-b964-42804e3a3eb5",
  "category": "国/審議会(子)",
  "list_url": "https://www.mhlw.go.jp/stf/shingi/shingi-kousei_429941_00002.html",
  "official_url": "https://www.mhlw.go.jp/stf/shingi/shingi-kousei_429941_00002.html"
}