{
  "id": "680b2c6a-afc0-4a55-95e4-1ebb59473c05",
  "name": "年金記録訂正分科会",
  "parent": "78d683d4-6555-4961-aebf-39848aff5e09",
  "category": "審議会(子)",
  "list_url": "https://www.mhlw.go.jp/stf/shingi/shingi-hosho_238274.html",
  "official_url": "https://www.mhlw.go.jp/stf/shingi/shingi-hosho_238274.html"
}