{
  "id": "3ac71474-e022-4d37-90a3-8884722bb092",
  "name": "今後の中長期的な厚生労働科学研究の在り方に関する専門委員会",
  "parent": "47021f2b-2b2e-42d7-bf65-e11041f3bb3d",
  "category": "審議会(子)",
  "list_url": "https://www.mhlw.go.jp/stf/shingi/shingi-kousei_127728.html",
  "official_url": "https://www.mhlw.go.jp/stf/shingi/shingi-kousei_127728.html"
}