{
  "id": "0c9bb1e3-16fc-47f5-a14e-7aeba93e4dd5",
  "name": "診療報酬基本問題小委員会",
  "parent": "7fed6615-074f-4b86-b78c-5b8eac7cb762",
  "category": "審議会(子)",
  "list_url": "https://www.mhlw.go.jp/stf/shingi/shingi-chuo_128161.html",
  "official_url": "https://www.mhlw.go.jp/stf/shingi/shingi-chuo_128161.html"
}