{
  "id": "67269093-a326-4481-881c-4086b2544805",
  "name": "年金部会",
  "parent": "fea307f7-8dcc-4fa8-9869-03a1d2620cf2",
  "category": "国/審議会(子)",
  "list_url": "https://www.mhlw.go.jp/stf/shingi/shingi-dokuritu_126775.html",
  "official_url": "https://www.mhlw.go.jp/stf/shingi/shingi-dokuritu_126775.html"
}