{
  "id": "46eaa02e-41b6-407c-82de-02d404f31514",
  "name": "確定拠出年金の運用に関する専門委員会",
  "parent": "2faa4696-edc0-4f4c-a09c-9842a91761e1",
  "category": "審議会(子)",
  "list_url": "https://www.mhlw.go.jp/stf/shingi/shingi-hosho_413946.html",
  "official_url": "https://www.mhlw.go.jp/stf/shingi/shingi-hosho_413946.html"
}