{
  "id": "82c58ce1-ba36-4062-8b6f-63eba9a883b7",
  "name": "歯科医師臨床研修部会",
  "parent": "58e94bfa-2a3e-468a-b343-5a3c0bdfc66f",
  "category": "国/審議会(子)",
  "list_url": "https://www.mhlw.go.jp/stf/shingi/shingi-idou_127796.html",
  "official_url": "https://www.mhlw.go.jp/stf/shingi/shingi-idou_127796.html"
}