{
  "id": "3a63b873-7c23-477b-9910-83d0516ab7f4",
  "name": "造血幹細胞移植委員会",
  "parent": "adbed643-3bef-4dc1-8c78-82f6d7c37d08",
  "category": "審議会(子)",
  "list_url": "https://www.mhlw.go.jp/stf/shingi/shingi-kousei_127747.html",
  "official_url": "https://www.mhlw.go.jp/stf/shingi/shingi-kousei_127747.html"
}