{
  "id": "32865dc2-67d3-487b-9038-1528fc158ebd",
  "name": "特定保険料納付申出等に係る承認基準専門委員会",
  "parent": "341ac0c3-43f3-44e6-b09f-f5734529cf07",
  "category": "国/審議会(子)",
  "list_url": "https://www.mhlw.go.jp/stf/shingi/shingi-hosho_281775.html",
  "official_url": "https://www.mhlw.go.jp/stf/shingi/shingi-hosho_281775.html"
}