{
  "id": "f7f5da8e-f2cc-4872-b808-3f75e22c9c1e",
  "name": "匿名障害福祉及び障害児福祉情報等の提供に関する専門委員会",
  "parent": "99db420f-77a4-4fe9-a45f-f6cfb304bbaf",
  "category": "審議会(子)",
  "list_url": "https://www.mhlw.go.jp/stf/shingi/shingi-hosho_126730_00008.html",
  "official_url": "https://www.mhlw.go.jp/stf/shingi/shingi-hosho_126730_00008.html"
}